{"schema":"ssrobot.RunBundle","version":1,"description":"4c69dbab95f933aec6633c44c6bb490580fdbec1c7cd2f4a694a4605cab534ce","model":"mjcf","model_signature":"93d4a0ae92e208b4a15e1a430e4c9420312c64f03e0854a9db6ebf3f9f1eb5b1","scene_entry":"scene.xml","scene_identity":"951908684a07cf2ed9c9081b8f3c942c6a8ffd28b85c2832e54efcf6d19aacd9","world":"93d4a0ae92e208b4a15e1a430e4c9420312c64f03e0854a9db6ebf3f9f1eb5b1:951908684a07cf2ed9c9081b8f3c942c6a8ffd28b85c2832e54efcf6d19aacd9","clock":"mujoco:conformance_bimanual","files":[{"path":"robot/bimanual.xml","sha256":"242b8023a4176480b3f2e41b094d7515d067eb25b69c9178979b7b46ce4c5bf5"},{"path":"robot/ssrobot.toml","sha256":"4c78a5a580b9f60a865496ddec98628b6afdfec9314db84044e2be9b23663a2b"},{"path":"scene/scene.xml","sha256":"24372a81c813644610a446bfaa9e9213487a86428a7f6cb9b62eeacb139c6b62"},{"path":"trace/trace.jsonl","sha256":"d9910da7ad4cc8cc8a789950625517240b9cf2a09234f9939fda7ab59a8e56d6"}]}
